"article","link","contributors","about","year","cited","addonlinks","year"
"An adaptive inertia weight teaching-learning-based optimization algorithm and its applications","https://scholar.google.com/citations?view_op=view_citation&hl=en&user=Pg36s_QAAAAJ&citation_for_view=Pg36s_QAAAAJ:lmc2jWPfTJgC","AK Shukla, P Singh, M Vardhan","Applied Mathematical Modelling 77, 309-326",", 2020","85","https://scholar.google.com/scholar?oi=bibs&hl=en&cites=11207887720999310706","2020"
"Fuzzy rule-based approach for software fault prediction","https://scholar.google.com/citations?view_op=view_citation&hl=en&user=Pg36s_QAAAAJ&citation_for_view=Pg36s_QAAAAJ:uWQEDVKXjbEC","P Singh, NR Pal, S Verma, OP Vyas","IEEE Transactions on Systems, Man, and Cybernetics: Systems 47 (5), 826-837",", 2016","81","https://scholar.google.com/scholar?oi=bibs&hl=en&cites=15220167459697759056","2016"
"A new hybrid wrapper TLBO and SA with SVM approach for gene expression data","https://scholar.google.com/citations?view_op=view_citation&hl=en&user=Pg36s_QAAAAJ&citation_for_view=Pg36s_QAAAAJ:MLfJN-KU85MC","AK Shukla, P Singh, M Vardhan","Information Sciences 503, 238-254",", 2019","61","https://scholar.google.com/scholar?oi=bibs&hl=en&cites=409805474074089056","2019"
"A two-stage gene selection method for biomarker discovery from microarray data for cancer classification","https://scholar.google.com/citations?view_op=view_citation&hl=en&user=Pg36s_QAAAAJ&citation_for_view=Pg36s_QAAAAJ:hMsQuOkrut0C","AK Shukla, P Singh, M Vardhan","Chemometrics and Intelligent Laboratory Systems 183, 47-58",", 2018","57","https://scholar.google.com/scholar?oi=bibs&hl=en&cites=18091121956076213618","2018"
"A hybrid gene selection method for microarray recognition","https://scholar.google.com/citations?view_op=view_citation&hl=en&user=Pg36s_QAAAAJ&citation_for_view=Pg36s_QAAAAJ:L7CI7m0gUJcC","AK Shukla, P Singh, M Vardhan","Biocybernetics and Biomedical Engineering 38 (4), 975-991",", 2018","57","https://scholar.google.com/scholar?oi=bibs&hl=en&cites=12099178711772952613","2018"
"Stacking-based multi-objective evolutionary ensemble framework for prediction of diabetes mellitus","https://scholar.google.com/citations?view_op=view_citation&hl=en&user=Pg36s_QAAAAJ&citation_for_view=Pg36s_QAAAAJ:kz9GbA2Ns4gC","N Singh, P Singh","Biocybernetics and Biomedical Engineering 40 (1), 1-22",", 2020","53","https://scholar.google.com/scholar?oi=bibs&hl=en&cites=15274561847227301200","2020"
"A survey of android application and malware hardening","https://scholar.google.com/citations?view_op=view_citation&hl=en&user=Pg36s_QAAAAJ&citation_for_view=Pg36s_QAAAAJ:86PQX7AUzd4C","V Sihag, M Vardhan, P Singh","Computer Science Review 39, 100365",", 2021","46","https://scholar.google.com/scholar?oi=bibs&hl=en&cites=4480874201499986512","2021"
"Gene selection for cancer types classification using novel hybrid metaheuristics approach","https://scholar.google.com/citations?view_op=view_citation&hl=en&user=Pg36s_QAAAAJ&citation_for_view=Pg36s_QAAAAJ:S16KYo8Pm5AC","AK Shukla, P Singh, M Vardhan","Swarm and Evolutionary Computation 54, 100661",", 2020","45","https://scholar.google.com/scholar?oi=bibs&hl=en&cites=16024823658323800556","2020"
"A new hybrid feature subset selection framework based on binary genetic algorithm and information theory","https://scholar.google.com/citations?view_op=view_citation&hl=en&user=Pg36s_QAAAAJ&citation_for_view=Pg36s_QAAAAJ:tuHXwOkdijsC","AK Shukla, P Singh, M Vardhan","International Journal of Computational Intelligence and Applications 18 (03 …",", 2019","45","https://scholar.google.com/scholar?oi=bibs&hl=en&cites=1275413677368394158","2019"
"A rule extraction approach from support vector machines for diagnosing hypertension among diabetics","https://scholar.google.com/citations?view_op=view_citation&hl=en&user=Pg36s_QAAAAJ&citation_for_view=Pg36s_QAAAAJ:kuK5TVdYjLIC","N Singh, P Singh, D Bhagat","Expert Systems with Applications 130, 188-205",", 2019","43","https://scholar.google.com/scholar?oi=bibs&hl=en&cites=3331778880436328587","2019"
"De-LADY: Deep learning based Android malware detection using Dynamic features.","https://scholar.google.com/citations?view_op=view_citation&hl=en&user=Pg36s_QAAAAJ&citation_for_view=Pg36s_QAAAAJ:kh2fBNsKQNwC","V Sihag, M Vardhan, P Singh, G Choudhary, S Son","J. Internet Serv. Inf. Secur. 11 (2), 34-45",", 2021","34","https://scholar.google.com/scholar?oi=bibs&hl=en&cites=17811523810774335099","2021"
"A hybrid ensemble-filter wrapper feature selection approach for medical data classification","https://scholar.google.com/citations?view_op=view_citation&hl=en&user=Pg36s_QAAAAJ&citation_for_view=Pg36s_QAAAAJ:bz8QjSJIRt4C","N Singh, P Singh","Chemometrics and Intelligent Laboratory Systems 217, 104396",", 2021","33","https://scholar.google.com/scholar?oi=bibs&hl=en&cites=6397721581218050044","2021"
"Empirical investigation of fault prediction capability of object oriented metrics of open source software","https://scholar.google.com/citations?view_op=view_citation&hl=en&user=Pg36s_QAAAAJ&citation_for_view=Pg36s_QAAAAJ:O3NaXMp0MMsC","P Singh, S Verma","2012 Ninth International Conference on Computer Science and Software …",", 2012","29","https://scholar.google.com/scholar?oi=bibs&hl=en&cites=12049221386896364120","2012"
"A hybrid framework for optimal feature subset selection","https://scholar.google.com/citations?view_op=view_citation&hl=en&user=Pg36s_QAAAAJ&citation_for_view=Pg36s_QAAAAJ:gsN89kCJA0AC","AK Shukla, P Singh, M Vardhan","Journal of Intelligent & Fuzzy Systems 36 (3), 2247-2259",", 2019","28","https://scholar.google.com/scholar?oi=bibs&hl=en&cites=17188016150695515943","2019"
"Survey of density based clustering algorithms and its variants","https://scholar.google.com/citations?view_op=view_citation&hl=en&user=Pg36s_QAAAAJ&citation_for_view=Pg36s_QAAAAJ:AXPGKjj_ei8C","P Singh, PA Meshram","2017 International Conference on Inventive Computing and Informatics (ICICI …",", 2017","27","https://scholar.google.com/scholar?oi=bibs&hl=en&cites=7406858713848495506","2017"
"A novel Bagged Naïve Bayes-Decision Tree approach for multi-class classification problems","https://scholar.google.com/citations?view_op=view_citation&hl=en&user=Pg36s_QAAAAJ&citation_for_view=Pg36s_QAAAAJ:TIZ-Mc8IlK0C","N Singh, P Singh","Journal of Intelligent & Fuzzy Systems 36 (3), 2261-2271",", 2019","26","https://scholar.google.com/scholar?oi=bibs&hl=en&cites=10638143350254579663","2019"
"An investigation of the effect of discretization on defect prediction using static measures","https://scholar.google.com/citations?view_op=view_citation&hl=en&user=Pg36s_QAAAAJ&citation_for_view=Pg36s_QAAAAJ:BqipwSGYUEgC","P Singh, S Verma","2009 International Conference on Advances in Computing, Control, and …",", 2009","26","https://scholar.google.com/scholar?oi=bibs&hl=en&cites=9988437775083209687","2009"
"BLADE: Robust malware detection against obfuscation in android","https://scholar.google.com/citations?view_op=view_citation&hl=en&user=Pg36s_QAAAAJ&citation_for_view=Pg36s_QAAAAJ:YohjEiUPhakC","V Sihag, M Vardhan, P Singh","Forensic Science International: Digital Investigation 38, 301176",", 2021","25","https://scholar.google.com/scholar?oi=bibs&hl=en&cites=10717568085505272241","2021"
"Building an effective approach toward Intrusion detection using ensemble feature selection","https://scholar.google.com/citations?view_op=view_citation&hl=en&user=Pg36s_QAAAAJ&citation_for_view=Pg36s_QAAAAJ:k8Z6L05lTy4C","AK Shukla, P Singh","International Journal of Information Security and Privacy (IJISP) 13 (3), 31-47",", 2019","24","https://scholar.google.com/scholar?oi=bibs&hl=en&cites=1672169688465180926","2019"
"Cardiac Arrhythmia Classification Using Machine Learning Techniques","https://scholar.google.com/citations?view_op=view_citation&hl=en&user=Pg36s_QAAAAJ&citation_for_view=Pg36s_QAAAAJ:tYavs44e6CUC","N Singh, P Singh","Engineering Vibration, Communication and Information Processing, 469-480",", 2019","23","https://scholar.google.com/scholar?oi=bibs&hl=en&cites=15679875909638460411","2019"
"Weight similarity measurement model based, object oriented approach for bug databases mining to detect similar and duplicate bugs","https://scholar.google.com/citations?view_op=view_citation&hl=en&user=Pg36s_QAAAAJ&cstart=20&pagesize=80&citation_for_view=Pg36s_QAAAAJ:ns9cj8rnVeAC","NK Nagwani, P Singh","Proceedings of the International Conference on Advances in Computing …",", 2009","22","https://scholar.google.com/scholar?oi=bibs&hl=en&cites=14531050746140310453","2009"
"Signature Based Malicious Behavior Detection in Android","https://scholar.google.com/citations?view_op=view_citation&hl=en&user=Pg36s_QAAAAJ&cstart=20&pagesize=80&citation_for_view=Pg36s_QAAAAJ:edDO8Oi4QzsC","V Sihag, A Swami, M Vardhan, P Singh","International Conference on Computing Science, Communication and Security …",", 2020","19","https://scholar.google.com/scholar?oi=bibs&hl=en&cites=2327583197458425978","2020"
"Cross company and within company fault prediction using object oriented metrics","https://scholar.google.com/citations?view_op=view_citation&hl=en&user=Pg36s_QAAAAJ&cstart=20&pagesize=80&citation_for_view=Pg36s_QAAAAJ:u_35RYKgDlwC","P Singh, S Verma, OP Vyas","International Journal of Computer Applications 74 (8)",", 2013","19","https://scholar.google.com/scholar?oi=bibs&hl=en&cites=16858388034492229621","2013"
"Comparative study of individual and ensemble methods of classification for credit scoring","https://scholar.google.com/citations?view_op=view_citation&hl=en&user=Pg36s_QAAAAJ&cstart=20&pagesize=80&citation_for_view=Pg36s_QAAAAJ:tkaPQYYpVKoC","P Singh","2017 International Conference on Inventive Computing and Informatics (ICICI …",", 2017","18","https://scholar.google.com/scholar?oi=bibs&hl=en&cites=11045353301176394310","2017"
"Simulation of Self-driving Car using Deep Learning","https://scholar.google.com/citations?view_op=view_citation&hl=en&user=Pg36s_QAAAAJ&cstart=20&pagesize=80&citation_for_view=Pg36s_QAAAAJ:PVjk1bu6vJQC","A Bhalla, MS Nikhila, P Singh","2020 3rd International Conference on Intelligent Sustainable Systems (ICISS …",", 2020","17","https://scholar.google.com/scholar?oi=bibs&hl=en&cites=14817920329235457994","2020"
"Neighbour teaching learning based optimization for global optimization problems","https://scholar.google.com/citations?view_op=view_citation&hl=en&user=Pg36s_QAAAAJ&cstart=20&pagesize=80&citation_for_view=Pg36s_QAAAAJ:9vf0nzSNQJEC","AK Shukla, P Singh, M Vardhan","Journal of Intelligent & Fuzzy Systems 34 (3), 1583-1594",", 2018","17","https://scholar.google.com/scholar?oi=bibs&hl=en&cites=7922268455242230948","2018"
"Cross project software fault prediction at design phase","https://scholar.google.com/citations?view_op=view_citation&hl=en&user=Pg36s_QAAAAJ&cstart=20&pagesize=80&citation_for_view=Pg36s_QAAAAJ:NhqRSupF_l8C","P Singh, S Verma","International Journal of Computer and Information Engineering 9 (3), 800-805",", 2015","17","https://scholar.google.com/scholar?oi=bibs&hl=en&cites=8205221190248612439","2015"
"An efficient software fault prediction model using cluster based classification","https://scholar.google.com/citations?view_op=view_citation&hl=en&user=Pg36s_QAAAAJ&cstart=20&pagesize=80&citation_for_view=Pg36s_QAAAAJ:EUQCXRtRnyEC","P Singh, S Verma","Int. J. Appl. Inf. Syst 7 (3), 35-41",", 2014","17","https://scholar.google.com/scholar?oi=bibs&hl=en&cites=12937818101766792205","2014"
"Comparing the effectiveness of machine learning algorithms for defect prediction","https://scholar.google.com/citations?view_op=view_citation&hl=en&user=Pg36s_QAAAAJ&cstart=20&pagesize=80&citation_for_view=Pg36s_QAAAAJ:GnPB-g6toBAC","P Singh","International Journal of Information Technology and Knowledge Management 2 …",", 2009","17","https://scholar.google.com/scholar?oi=bibs&hl=en&cites=2469226410518618982","2009"
"Investigating the effect of feature selection and dimensionality reduction on phishing website classification problem","https://scholar.google.com/citations?view_op=view_citation&hl=en&user=Pg36s_QAAAAJ&cstart=20&pagesize=80&citation_for_view=Pg36s_QAAAAJ:fQNAKQ3IYiAC","P Singh, N Jain, A Maini","2015 1st International Conference on Next Generation Computing Technologies …",", 2015","15","https://scholar.google.com/scholar?oi=bibs&hl=en&cites=5447389059938835171","2015"
"A Stacked Generalization Approach for Diagnosis and Prediction of Type 2 Diabetes Mellitus","https://scholar.google.com/citations?view_op=view_citation&hl=en&user=Pg36s_QAAAAJ&cstart=20&pagesize=80&citation_for_view=Pg36s_QAAAAJ:LI9QrySNdTsC","N Singh, P Singh","Computational Intelligence in Data Mining, 559-570",", 2020","13","https://scholar.google.com/scholar?oi=bibs&hl=en&cites=10217436206768577343","2020"
"Hybrid approach for gene selection and classification using filter and genetic algorithm","https://scholar.google.com/citations?view_op=view_citation&hl=en&user=Pg36s_QAAAAJ&cstart=20&pagesize=80&citation_for_view=Pg36s_QAAAAJ:eMMeJKvmdy0C","P Singh, A Shukla, M Vardhan","2017 International Conference on Inventive Computing and Informatics (ICICI …",", 2017","13","https://scholar.google.com/scholar?oi=bibs&hl=en&cites=9583653235196114285","2017"
"An investigation of the relationships between software metrics and defects","https://scholar.google.com/citations?view_op=view_citation&hl=en&user=Pg36s_QAAAAJ&cstart=20&pagesize=80&citation_for_view=Pg36s_QAAAAJ:NaGl4SEjCO4C","P Singh, KD Chaudhary, S Verma","International Journal of Computer Applications 28 (8), 13-17",", 2011","13","https://scholar.google.com/scholar?oi=bibs&hl=en&cites=8930918500968010267","2011"
"Compositional framework for multitask learning in the identification of cleavage sites of HIV-1 protease","https://scholar.google.com/citations?view_op=view_citation&hl=en&user=Pg36s_QAAAAJ&cstart=20&pagesize=80&citation_for_view=Pg36s_QAAAAJ:i2xiXl-TujoC","D Singh, DS Sisodia, P Singh","Journal of Biomedical Informatics 102, 103376",", 2020","12","https://scholar.google.com/scholar?oi=bibs&hl=en&cites=16215662855784742413","2020"
"DNA Gene Expression Analysis on Diffuse Large B-Cell Lymphoma (DLBCL) Based on Filter Selection Method with Supervised Classification Method","https://scholar.google.com/citations?view_op=view_citation&hl=en&user=Pg36s_QAAAAJ&cstart=20&pagesize=80&citation_for_view=Pg36s_QAAAAJ:tKAzc9rXhukC","AK Shukla, P Singh, M Vardhan","Computational Intelligence in Data Mining, 783-792",", 2019","12","https://scholar.google.com/scholar?oi=bibs&hl=en&cites=12921271276693613034","2019"
"Putative drug and vaccine target identification in Leishmania donovani membrane proteins using naive bayes probabilistic classifier","https://scholar.google.com/citations?view_op=view_citation&hl=en&user=Pg36s_QAAAAJ&cstart=20&pagesize=80&citation_for_view=Pg36s_QAAAAJ:D_sINldO8mEC","AK Sinha, P Singh, A Prakash, D Pal, A Dube, A Kumar","IEEE/ACM transactions on computational biology and bioinformatics 14 (1 …",", 2017","12","https://scholar.google.com/scholar?oi=bibs&hl=en&cites=16436439321024133421","2017"
"PICAndro: Packet InspeCtion-Based Android Malware Detection","https://scholar.google.com/citations?view_op=view_citation&hl=en&user=Pg36s_QAAAAJ&cstart=20&pagesize=80&citation_for_view=Pg36s_QAAAAJ:anf4URPfarAC","V Sihag, G Choudhary, M Vardhan, P Singh, JT Seo","Security and Communication Networks 2021",", 2021","11","https://scholar.google.com/scholar?oi=bibs&hl=en&cites=2765134403394882293","2021"
"Software Defect Prediction using Deep Learning","https://scholar.google.com/citations?view_op=view_citation&hl=en&user=Pg36s_QAAAAJ&cstart=20&pagesize=80&citation_for_view=Pg36s_QAAAAJ:NXb4pA-qfm4C","M Nevendra, P Singh","Acta Polytechnica Hungarica 18 (10)",", 2021","10","https://scholar.google.com/scholar?oi=bibs&hl=en&cites=12205497235277282735","2021"
"Medical Diagnosis of Parkinson Disease Driven by Multiple Preprocessing Technique with Scarce Lee Silverman Voice Treatment Data","https://scholar.google.com/citations?view_op=view_citation&hl=en&user=Pg36s_QAAAAJ&cstart=20&pagesize=80&citation_for_view=Pg36s_QAAAAJ:KUbvn5osdkgC","AK Shukla, P Singh, M Vardhan","Engineering Vibration, Communication and Information Processing, 407-421",", 2019","10","https://scholar.google.com/scholar?oi=bibs&hl=en&cites=14599815975422394382","2019"
"A novel filter approach for efficient selection and small round blue-cell tumor cancer detection using microarray gene expression data","https://scholar.google.com/citations?view_op=view_citation&hl=en&user=Pg36s_QAAAAJ&cstart=20&pagesize=80&citation_for_view=Pg36s_QAAAAJ:WA5NYHcadZ8C","P Singh, A Shukla, M Vardhan","2017 International Conference on Inventive Computing and Informatics (ICICI …",", 2017","10","https://scholar.google.com/scholar?oi=bibs&hl=en&cites=5802646754438116761","2017"
"Rule Based Approach for Prediction of Chronic Kidney Disease: A Comparative Study","https://scholar.google.com/citations?view_op=view_citation&hl=en&user=Pg36s_QAAAAJ&cstart=20&pagesize=80&citation_for_view=Pg36s_QAAAAJ:NJ774b8OgUMC","N Singh, P Singh","Biomed Pharmacol J 10 (2)",", 2017","10","https://scholar.google.com/scholar?oi=bibs&hl=en&cites=18039389988113856084","2017"
"Evolutionary based optimal ensemble classifiers for HIV-1 protease cleavage sites prediction","https://scholar.google.com/citations?view_op=view_citation&hl=en&user=Pg36s_QAAAAJ&cstart=20&pagesize=80&citation_for_view=Pg36s_QAAAAJ:W5xh706n7nkC","D Singh, P Singh, DS Sisodia","Expert Systems with Applications 109, 86-99",", 2018","9","https://scholar.google.com/scholar?oi=bibs&hl=en&cites=5946760417383421590","2018"
"Opcode n-gram based Malware Classification in Android","https://scholar.google.com/citations?view_op=view_citation&hl=en&user=Pg36s_QAAAAJ&cstart=20&pagesize=80&citation_for_view=Pg36s_QAAAAJ:hCrLmN-GePgC","V Sihag, A Mitharwal, M Vardhan, P Singh","2020 Fourth World Conference on Smart Trends in Systems, Security and …",", 2020","8","https://scholar.google.com/scholar?oi=bibs&hl=en&cites=10477520411478573048","2020"
"Hybrid TLBO-GSA strategy for constrained and unconstrained engineering optimization functions","https://scholar.google.com/citations?view_op=view_citation&hl=en&user=Pg36s_QAAAAJ&cstart=20&pagesize=80&citation_for_view=Pg36s_QAAAAJ:ILKRHgRFtOwC","AK Shukla, P Singh, M Vardhan","Hybrid Metaheuristics Res Appl 84, 41",", 2018","8","https://scholar.google.com/scholar?oi=bibs&hl=en&cites=7792142772369592923","2018"
"Software fault prediction at design phase","https://scholar.google.com/citations?view_op=view_citation&hl=en&user=Pg36s_QAAAAJ&cstart=20&pagesize=80&citation_for_view=Pg36s_QAAAAJ:b0M2c_1WBrUC","P Singh, S Verma, OP Vyas","Journal of Electrical Engineering and Technology 9 (5), 1739-1745",", 2014","8","https://scholar.google.com/scholar?oi=bibs&hl=en&cites=14465592055982902948","2014"
"An Agile Methodology Based Model for Change-Oriented Software Engineering","https://scholar.google.com/citations?view_op=view_citation&hl=en&user=Pg36s_QAAAAJ&cstart=20&pagesize=80&citation_for_view=Pg36s_QAAAAJ:f2IySw72cVMC","NK Nagwani, P Singh","International Journal of Recent Trends in Engineering 1 (1), 128",", 2009","8","https://scholar.google.com/scholar?oi=bibs&hl=en&cites=17665685274416581237","2009"
"Empirical investigation of hyperparameter optimization for software defect count prediction","https://scholar.google.com/citations?view_op=view_citation&hl=en&user=Pg36s_QAAAAJ&cstart=20&pagesize=80&citation_for_view=Pg36s_QAAAAJ:0izLItjtcgwC","M Nevendra, P Singh","Expert Systems with Applications 191, 116217",", 2022","7","https://scholar.google.com/scholar?oi=bibs&hl=en&cites=13387624160189344398","2022"
"Software bug count prediction via AdaBoost. R-ET","https://scholar.google.com/citations?view_op=view_citation&hl=en&user=Pg36s_QAAAAJ&cstart=20&pagesize=80&citation_for_view=Pg36s_QAAAAJ:e_rmSamDkqQC","M Nevendra, P Singh","2019 IEEE 9th International Conference on Advanced Computing (IACC), 7-12",", 2019","7","https://scholar.google.com/scholar?oi=bibs&hl=en&cites=3551833443916941010","2019"
"Evolutionary based ensemble framework for realizing transfer learning in HIV-1 Protease cleavage sites prediction","https://scholar.google.com/citations?view_op=view_citation&hl=en&user=Pg36s_QAAAAJ&cstart=20&pagesize=80&citation_for_view=Pg36s_QAAAAJ:g3aElNc5_aQC","D Singh, P Singh, DS Sisodia","Applied Intelligence 49 (4), 1260-1282",", 2019","7","https://scholar.google.com/scholar?oi=bibs&hl=en&cites=7078213530379209830","2019"
"An Assistive Tool For Fileless Malware Detection","https://scholar.google.com/citations?view_op=view_citation&hl=en&user=Pg36s_QAAAAJ&cstart=20&pagesize=80&citation_for_view=Pg36s_QAAAAJ:9pM33mqn1YgC","P Borana, V Sihag, G Choudhary, M Vardhan, P Singh","2021 World Automation Congress (WAC), 21-25",", 2021","6","https://scholar.google.com/scholar?oi=bibs&hl=en&cites=16807933632619221606","2021"
"Text Imbalance Handling and Classification for Cross-platform Cyber-crime Detection using Deep Learning","https://scholar.google.com/citations?view_op=view_citation&hl=en&user=Pg36s_QAAAAJ&cstart=20&pagesize=80&citation_for_view=Pg36s_QAAAAJ:Ug5p-4gJ2f0C","MS Nikhila, A Bhalla, P Singh","2020 11th International Conference on Computing, Communication and …",", 2020","6","https://scholar.google.com/scholar?oi=bibs&hl=en&cites=16217168670130753977","2020"
"Multi-Objective Evolutionary approach for the Performance Improvement of Learners using Ensembling Feature selection and Discretization Technique on Medical data","https://scholar.google.com/citations?view_op=view_citation&hl=en&user=Pg36s_QAAAAJ&cstart=20&pagesize=80&citation_for_view=Pg36s_QAAAAJ:foquWX3nUaYC","D Singh, DS Sisodia, P Singh","Current Medical Imaging 16 (4), 355-370",", 2020","6","https://scholar.google.com/scholar?oi=bibs&hl=en&cites=8828213916273581086","2020"
"Class Imbalance Deep Learning for Bankruptcy Prediction","https://scholar.google.com/citations?view_op=view_citation&hl=en&user=Pg36s_QAAAAJ&cstart=20&pagesize=80&citation_for_view=Pg36s_QAAAAJ:q3CdL3IzO_QC","S Vellamcheti, P Singh","2020 First International Conference on Power, Control and Computing …",", 2020","6","https://scholar.google.com/scholar?oi=bibs&hl=en&cites=9983833818594775471","2020"
"Demonetization: Sentiment and Retweet Analysis","https://scholar.google.com/citations?view_op=view_citation&hl=en&user=Pg36s_QAAAAJ&cstart=20&pagesize=80&citation_for_view=Pg36s_QAAAAJ:t6usbXjVLHcC","P Singh, A Dave, K Dar","2017 International Conference on Inventive Computing and Informatics (ICICI …",", 2017","6","https://scholar.google.com/scholar?oi=bibs&hl=en&cites=2029096219567066331","2017"
"Software Fault Prediction Model for Embedded Systems: A Novel finding","https://scholar.google.com/citations?view_op=view_citation&hl=en&user=Pg36s_QAAAAJ&cstart=20&pagesize=80&citation_for_view=Pg36s_QAAAAJ:dshw04ExmUIC","P Singh, S Verma","Int. J. Comput. Sci. Inf. Technol 5 (2), 2348-2354",", 2014","6","https://scholar.google.com/scholar?oi=bibs&hl=en&cites=14684102458241424167","2014"
"Defect count prediction via metric-based convolutional neural network","https://scholar.google.com/citations?view_op=view_citation&hl=en&user=Pg36s_QAAAAJ&cstart=20&pagesize=80&citation_for_view=Pg36s_QAAAAJ:rmuvC79q63oC","M Nevendra, P Singh","Neural Computing and Applications 33 (22), 15319-15344",", 2021","5","https://scholar.google.com/scholar?oi=bibs&hl=en&cites=9719259716205806553","2021"
"Enhancing Aggression Detection using GPT-2 based Data Balancing Technique","https://scholar.google.com/citations?view_op=view_citation&hl=en&user=Pg36s_QAAAAJ&cstart=20&pagesize=80&citation_for_view=Pg36s_QAAAAJ:4fGpz3EwCPoC","A Shrivastava, R Pupale, P Singh","2021 5th International Conference on Intelligent Computing and Control …",", 2021","5","https://scholar.google.com/scholar?oi=bibs&hl=en&cites=628368038989228210","2021"
"State-of-the-Art Review of Deep Learning for Medical Image Analysis","https://scholar.google.com/citations?view_op=view_citation&hl=en&user=Pg36s_QAAAAJ&cstart=20&pagesize=80&citation_for_view=Pg36s_QAAAAJ:5qfkUJPXOUwC","S Garg, P Singh","2020 3rd International Conference on Intelligent Sustainable Systems (ICISS …",", 2020","5","https://scholar.google.com/scholar?oi=bibs&hl=en&cites=1926886688403686744","2020"
"Compositional model based on factorial evolution for realizing multi-task learning in bacterial virulent protein prediction","https://scholar.google.com/citations?view_op=view_citation&hl=en&user=Pg36s_QAAAAJ&cstart=20&pagesize=80&citation_for_view=Pg36s_QAAAAJ:VaXvl8Fpj5cC","D Singh, P Singh, DS Sisodia","Artificial Intelligence in Medicine 101, 101757",", 2019","5","https://scholar.google.com/scholar?oi=bibs&hl=en&cites=16545088533664970322","2019"
"Learning from Software defect datasets","https://scholar.google.com/citations?view_op=view_citation&hl=en&user=Pg36s_QAAAAJ&cstart=20&pagesize=80&citation_for_view=Pg36s_QAAAAJ:WZBGuue-350C","P Singh","2019 5th International Conference on Signal Processing, Computing and …",", 2019","5","https://scholar.google.com/scholar?oi=bibs&hl=en&cites=3552386229208268020","2019"
"An Empirical Study on Multi-Objective Swarm Algorithm for Standard Multi-Objective Benchmark Problems","https://scholar.google.com/citations?view_op=view_citation&hl=en&user=Pg36s_QAAAAJ&cstart=20&pagesize=80&citation_for_view=Pg36s_QAAAAJ:eq2jaN3J8jMC","AK Shukla, P Singh, M Vardhan","Proceedings of 3rd International Conference on Internet of Things and …",", 2018","5","https://scholar.google.com/scholar?oi=bibs&hl=en&cites=10643169527147823865","2018"
