"article","link","contributors","about","year","cited","addonlinks","year"
"A model for sentiment and emotion analysis of unstructured social media text","https://scholar.google.com/citations?view_op=view_citation&hl=en&user=kWDOTCUAAAAJ&citation_for_view=kWDOTCUAAAAJ:zYLM7Y9cAGgC","JK Rout, KKR Choo, AK Dash, S Bakshi, SK Jena, KL Williams","Electronic Commerce Research, 1-19",", 2017","172","https://scholar.google.com/scholar?oi=bibs&hl=en&cites=4064076866299082168","2017"
"Revisiting semi-supervised learning for online deceptive review detection","https://scholar.google.com/citations?view_op=view_citation&hl=en&user=kWDOTCUAAAAJ&citation_for_view=kWDOTCUAAAAJ:IjCSPb-OGe4C","JK Rout, A Dalmia, KKR Choo, S Bakshi, SK Jena","IEEE access 5, 1319-1327",", 2017","131","https://scholar.google.com/scholar?oi=bibs&hl=en&cites=16876154470273436113","2017"
"Deceptive review detection using labeled and unlabeled data","https://scholar.google.com/citations?view_op=view_citation&hl=en&user=kWDOTCUAAAAJ&citation_for_view=kWDOTCUAAAAJ:2osOgNQ5qMEC","JK Rout, S Singh, SK Jena, S Bakshi","Multimedia Tools and Applications 76, 3187-3211",", 2017","79","https://scholar.google.com/scholar?oi=bibs&hl=en&cites=10607224678520761273","2017"
"Review spam detection using opinion mining","https://scholar.google.com/citations?view_op=view_citation&hl=en&user=kWDOTCUAAAAJ&citation_for_view=kWDOTCUAAAAJ:W7OEmFMy1HYC","R Narayan, JK Rout, SK Jena","Progress in Intelligent Computing Techniques: Theory, Practice, and …",", 2018","32","https://scholar.google.com/scholar?oi=bibs&hl=en&cites=18054240356593874743","2018"
"Review spam detection using semi-supervised technique","https://scholar.google.com/citations?view_op=view_citation&hl=en&user=kWDOTCUAAAAJ&citation_for_view=kWDOTCUAAAAJ:Tyk-4Ss8FVUC","R Narayan, JK Rout, SK Jena","Progress in Intelligent Computing Techniques: Theory, Practice, and …",", 2018","28","https://scholar.google.com/scholar?oi=bibs&hl=en&cites=2623872531410943874","2018"
"An ensemble-based scalable approach for intrusion detection using big data framework","https://scholar.google.com/citations?view_op=view_citation&hl=en&user=kWDOTCUAAAAJ&citation_for_view=kWDOTCUAAAAJ:qxL8FJ1GzNcC","SK Sahu, DP Mohapatra, JK Rout, KS Sahoo, AK Luhach","Big Data 9 (4), 303-321",", 2021","22","https://scholar.google.com/scholar?oi=bibs&hl=en&cites=12571068643728048076","2021"
"A framework for fake review detection: issues and challenges","https://scholar.google.com/citations?view_op=view_citation&hl=en&user=kWDOTCUAAAAJ&citation_for_view=kWDOTCUAAAAJ:LkGwnXOMwfcC","JK Rout, AK Dash, NK Ray","2018 international conference on information technology (ICIT), 7-10",", 2018","21","https://scholar.google.com/scholar?oi=bibs&hl=en&cites=2109413408371624410","2018"
"A LSTM-FCNN based multi-class intrusion detection using scalable framework","https://scholar.google.com/citations?view_op=view_citation&hl=en&user=kWDOTCUAAAAJ&citation_for_view=kWDOTCUAAAAJ:ZeXyd9-uunAC","SK Sahu, DP Mohapatra, JK Rout, KS Sahoo, QV Pham, NN Dao","Computers and Electrical Engineering 99, 107720",", 2022","20","https://scholar.google.com/scholar?oi=bibs&hl=en&cites=5566197842331597674","2022"
"Teaching–learning optimization based cascaded low-complexity neural network model for exchange rates forecasting","https://scholar.google.com/citations?view_op=view_citation&hl=en&user=kWDOTCUAAAAJ&citation_for_view=kWDOTCUAAAAJ:UebtZRa9Y70C","M Rout, AK Jena, JK Rout, H Das","Smart Intelligent Computing and Applications: Proceedings of the Third …",", 2020","16","https://scholar.google.com/scholar?oi=bibs&hl=en&cites=2160700715814666246","2020"
"A group based time quantum round robin algorithm using min-max spread measure","https://scholar.google.com/citations?view_op=view_citation&hl=en&user=kWDOTCUAAAAJ&citation_for_view=kWDOTCUAAAAJ:u5HHmVD_uO8C","SK Panda, D Dash, JK Rout","arXiv preprint arXiv:1403.0335",", 2014","14","https://scholar.google.com/scholar?oi=bibs&hl=en&cites=16480844971208675073","2014"
"Harnessing twitter for automatic sentiment identification using machine learning techniques","https://scholar.google.com/citations?view_op=view_citation&hl=en&user=kWDOTCUAAAAJ&citation_for_view=kWDOTCUAAAAJ:d1gkVwhDpl0C","AK Dash, JK Rout, SK Jena","Proceedings of 3rd International Conference on Advanced Computing …",", 2016","13","https://scholar.google.com/scholar?oi=bibs&hl=en&cites=6186619739608817787","2016"
"Nature inspired computing for data science","https://scholar.google.com/citations?view_op=view_citation&hl=en&user=kWDOTCUAAAAJ&citation_for_view=kWDOTCUAAAAJ:hqOjcs7Dif8C","M Rout, JK Rout, H Das","Springer International Publishing",", 2020","12","https://scholar.google.com/scholar?oi=bibs&hl=en&cites=17318139262871170891","2020"
"Malicious account detection based on short URLs in Twitter","https://scholar.google.com/citations?view_op=view_citation&hl=en&user=kWDOTCUAAAAJ&citation_for_view=kWDOTCUAAAAJ:UeHWp8X0CEIC","R Venkatesh, JK Rout, SK Jena","Proceedings of the International Conference on Signal, Networks, Computing …",", 2017","12","https://scholar.google.com/scholar?oi=bibs&hl=en&cites=5761728926789733272","2017"
"Sftp: a secure and fault-tolerant paradigm against blackhole attack in manet","https://scholar.google.com/citations?view_op=view_citation&hl=en&user=kWDOTCUAAAAJ&citation_for_view=kWDOTCUAAAAJ:u-x6o8ySG0sC","JK Rout, SK Bhoi, SK Panda","arXiv preprint arXiv:1403.0338",", 2014","9","https://scholar.google.com/scholar?oi=bibs&hl=en&cites=3764628685973248845","2014"
"Applied Intelligent Decision Making in Machine Learning","https://scholar.google.com/citations?view_op=view_citation&hl=en&user=kWDOTCUAAAAJ&citation_for_view=kWDOTCUAAAAJ:KlAtU1dfN6UC","H Das, JK Rout, SC Moharana, N Dey","CRC Press",", 2020","7","https://scholar.google.com/scholar?oi=bibs&hl=en&cites=9639855524185770431","2020"
"Role of Machine Learning and Cloud-Driven Platform in IoT-Based Smart Farming","https://scholar.google.com/citations?view_op=view_citation&hl=en&user=kWDOTCUAAAAJ&citation_for_view=kWDOTCUAAAAJ:-f6ydRqryjwC","AK Pradhan, S Swain, J Kumar Rout","Machine Learning and Internet of Things for Societal Issues, 43-54",", 2022","6","https://scholar.google.com/scholar?oi=bibs&hl=en&cites=6484933961707002333","2022"
"Machine learning for intelligent decision science","https://scholar.google.com/citations?view_op=view_citation&hl=en&user=kWDOTCUAAAAJ&citation_for_view=kWDOTCUAAAAJ:5nxA0vEk-isC","JK Rout, M Rout, H Das","Springer",", 2020","6","https://scholar.google.com/scholar?oi=bibs&hl=en&cites=6193982104648309107","2020"
"Detecting product review spammers using principles of big data","https://scholar.google.com/citations?view_op=view_citation&hl=en&user=kWDOTCUAAAAJ&citation_for_view=kWDOTCUAAAAJ:9ZlFYXVOiuMC","JK Rout, A Dalmia, SK Rath, BK Mohanta, S Ramasubbareddy, ...","IEEE Transactions on engineering management",", 2021","5","https://scholar.google.com/scholar?oi=bibs&hl=en&cites=4341428651943800211","2021"
"A Machine Learning Approach for the Prediction of Fetal Health using CTG","https://scholar.google.com/citations?view_op=view_citation&hl=en&user=kWDOTCUAAAAJ&citation_for_view=kWDOTCUAAAAJ:TQgYirikUcIC","AK Pradhan, JK Rout, AB Maharana, BK Balabantaray, NK Ray","2021 19th OITS International Conference on Information Technology (OCIT …",", 2021","4","https://scholar.google.com/scholar?oi=bibs&hl=en&cites=15827335914782947710","2021"
"Bankruptcy Prediction using Robust Machine Learning Model","https://scholar.google.com/citations?view_op=view_citation&hl=en&user=kWDOTCUAAAAJ&citation_for_view=kWDOTCUAAAAJ:M3ejUd6NZC8C","MR Amer Tabbakh, Jitendra Kumar Rout, Kshira Sagar Sahoo, NZ Jhanjhi ...","Turkish Journal of Computer and Mathematics Education (TURCOMAT) 12 (10 …",", 2021","4","https://scholar.google.com/scholar?oi=bibs&hl=en&cites=7659549684788803321","2021"
"Analysis and Prediction of the Survival of Titanic Passengers Using Machine Learning","https://scholar.google.com/citations?view_op=view_citation&hl=en&user=kWDOTCUAAAAJ&cstart=20&pagesize=80&citation_for_view=kWDOTCUAAAAJ:MXK_kJrjxJIC","A Tabbakh, JK Rout, M Rout","Advances in Distributed Computing and Machine Learning: Proceedings of …",", 2021","4","https://scholar.google.com/scholar?oi=bibs&hl=en&cites=2441083169058687245","2021"
"Sentiment analysis using weight model based on SentiWordNet 3.0","https://scholar.google.com/citations?view_op=view_citation&hl=en&user=kWDOTCUAAAAJ&cstart=20&pagesize=80&citation_for_view=kWDOTCUAAAAJ:_FxGoFyzp5QC","J Kumar, JK Rout, A katiyar, SK Jena","Recent Findings in Intelligent Computing Techniques: Proceedings of the 5th …",", 2018","4","https://scholar.google.com/scholar?oi=bibs&hl=en&cites=2903230687689398951","2018"
"Construct-based sentiment analysis model","https://scholar.google.com/citations?view_op=view_citation&hl=en&user=kWDOTCUAAAAJ&cstart=20&pagesize=80&citation_for_view=kWDOTCUAAAAJ:qjMakFHDy7sC","S Singh, JK Rout, SK Jena","Proceedings of the International Conference on Signal, Networks, Computing …",", 2016","3","https://scholar.google.com/scholar?oi=bibs&hl=en&cites=8175551140758832497","2016"
"Prediction of Stroke Disease Using Different Types of Gradient Boosting Classifiers","https://scholar.google.com/citations?view_op=view_citation&hl=en&user=kWDOTCUAAAAJ&cstart=20&pagesize=80&citation_for_view=kWDOTCUAAAAJ:R3hNpaxXUhUC","AK Pradhan, S Swain, JK Rout, NK Ray","Advances in Data Computing, Communication and Security: Proceedings of …",", 2022","2","https://scholar.google.com/scholar?oi=bibs&hl=en&cites=6975353883613152862","2022"
"Analysis and prevention of road accidents","https://scholar.google.com/citations?view_op=view_citation&hl=en&user=kWDOTCUAAAAJ&cstart=20&pagesize=80&citation_for_view=kWDOTCUAAAAJ:Zph67rFs4hoC","BP Saha, JK Rout","International Conference on Emerging Trends and Advances in Electrical …",", 2020","2","https://scholar.google.com/scholar?oi=bibs&hl=en&cites=7639822761135423800","2020"
"A constructive model for sentiment analysis of speech using deep learning","https://scholar.google.com/citations?view_op=view_citation&hl=en&user=kWDOTCUAAAAJ&cstart=20&pagesize=80&citation_for_view=kWDOTCUAAAAJ:Se3iqnhoufwC","AK Dash, R Pradhan, JK Rout, NK Ray","2018 International Conference on Information Technology (ICIT), 1-6",", 2018","2","https://scholar.google.com/scholar?oi=bibs&hl=en&cites=17126771460484093854","2018"
"An improved certificateless generalized signcryption scheme","https://scholar.google.com/citations?view_op=view_citation&hl=en&user=kWDOTCUAAAAJ&cstart=20&pagesize=80&citation_for_view=kWDOTCUAAAAJ:9yKSN-GCB0IC","JK Rout","","","2","https://scholar.google.com/scholar?oi=bibs&hl=en&cites=16663536508828515075","2013"
"Detection of credit card fraud by applying genetic algorithm and particle swarm optimization","https://scholar.google.com/citations?view_op=view_citation&hl=en&user=kWDOTCUAAAAJ&cstart=20&pagesize=80&citation_for_view=kWDOTCUAAAAJ:7PzlFSSx8tAC","D Prusti, JK Rout, SK Rath","Machine Learning, Image Processing, Network Security and Data Sciences …",", 2023","1","https://scholar.google.com/scholar?oi=bibs&hl=en&cites=3351526797006318541","2023"
"Classification of News Articles with Relational Multi Attributes using Machine Learning","https://scholar.google.com/citations?view_op=view_citation&hl=en&user=kWDOTCUAAAAJ&cstart=20&pagesize=80&citation_for_view=kWDOTCUAAAAJ:HDshCWvjkbEC","CB Thaokar, JK Rout, M Rout","2021 19th OITS International Conference on Information Technology (OCIT …",", 2021","1","https://scholar.google.com/scholar?oi=bibs&hl=en&cites=10901079954480629810","2021"
"Implementation of a Malware Scanner using Signature-Based Approach for Android Applications","https://scholar.google.com/citations?view_op=view_citation&hl=en&user=kWDOTCUAAAAJ&cstart=20&pagesize=80&citation_for_view=kWDOTCUAAAAJ:hFOr9nPyWt4C","PR Pardhi, JK Rout, NK Ray","2021 19th OITS International Conference on Information Technology (OCIT), 14-19",", 2021","1","https://scholar.google.com/scholar?oi=bibs&hl=en&cites=7135739383862104184","2021"
"Analysis and Prediction of Cardiovascular Disease Using Machine Learning Techniques","https://scholar.google.com/citations?view_op=view_citation&hl=en&user=kWDOTCUAAAAJ&cstart=20&pagesize=80&citation_for_view=kWDOTCUAAAAJ:_kc_bZDykSQC","BK Mengiste, HK Tripathy, JK Rout","International Conference on Emerging Trends and Advances in Electrical …",", 2020","1","https://scholar.google.com/scholar?oi=bibs&hl=en&cites=8679445333506514566","2020"
"Correction to: Nature Inspired Computing for Data Science","https://scholar.google.com/citations?view_op=view_citation&hl=en&user=kWDOTCUAAAAJ&cstart=20&pagesize=80&citation_for_view=kWDOTCUAAAAJ:0EnyYjriUFMC","M Rout, JK Rout, H Das","Nature Inspired Computing for Data Science, C1-C1",", 2020","1","https://scholar.google.com/scholar?oi=bibs&hl=en&cites=3706640252818461995","2020"
"A hybrid learning method for distinguishing lung adenocarcinoma and squamous cell carcinoma","https://scholar.google.com/citations?view_op=view_citation&hl=en&user=kWDOTCUAAAAJ&cstart=20&pagesize=80&citation_for_view=kWDOTCUAAAAJ:maZDTaKrznsC","AK Swain, A Swetapadma, JK Rout, BK Balabantaray","Data Technologies and Applications",", 2023","","https://scholar.google.com/citations?user=kWDOTCUAAAAJ&hl=en&oi=ao","2023"
"Understanding Large-Scale Network Effects in Detecting Review Spammers","https://scholar.google.com/citations?view_op=view_citation&hl=en&user=kWDOTCUAAAAJ&cstart=20&pagesize=80&citation_for_view=kWDOTCUAAAAJ:iH-uZ7U-co4C","JK Rout, KS Sahoo, A Dalmia, S Bakshi, M Bilal, H Song","IEEE Transactions on Computational Social Systems",", 2023","","https://scholar.google.com/citations?user=kWDOTCUAAAAJ&hl=en&oi=ao","2023"
"A Deep Learning based Approach to Stock Market Price Prediction using Technical indicators","https://scholar.google.com/citations?view_op=view_citation&hl=en&user=kWDOTCUAAAAJ&cstart=20&pagesize=80&citation_for_view=kWDOTCUAAAAJ:k_IJM867U9cC","N Parida, BK Balabantaray, R Nayak, JK Rout","2023 International Conference on Advances in Intelligent Computing and …",", 2023","","https://scholar.google.com/citations?user=kWDOTCUAAAAJ&hl=en&oi=ao","2023"
"A Multi-Linguistic Fake news detector on Hindi, Marathi and Telugu","https://scholar.google.com/citations?view_op=view_citation&hl=en&user=kWDOTCUAAAAJ&cstart=20&pagesize=80&citation_for_view=kWDOTCUAAAAJ:isC4tDSrTZIC","CB Thaokar, M Rathod, S Ahmed, JK Rout, M Rout","2022 OITS International Conference on Information Technology (OCIT), 324-329",", 2022","","https://scholar.google.com/citations?user=kWDOTCUAAAAJ&hl=en&oi=ao","2022"
"A Study on Performance Comparison of Algorithms for Detecting the Flooding DDoS Attack","https://scholar.google.com/citations?view_op=view_citation&hl=en&user=kWDOTCUAAAAJ&cstart=20&pagesize=80&citation_for_view=kWDOTCUAAAAJ:TFP_iSt0sucC","PR Pardhi, JK Rout, NK Ray","2022 OITS International Conference on Information Technology (OCIT), 433-438",", 2022","","https://scholar.google.com/citations?user=kWDOTCUAAAAJ&hl=en&oi=ao","2022"
"IFChatbot: Convolutional Neural Network based chatbot for Image Forgery Detection and Localization","https://scholar.google.com/citations?view_op=view_citation&hl=en&user=kWDOTCUAAAAJ&cstart=20&pagesize=80&citation_for_view=kWDOTCUAAAAJ:4JMBOYKVnBMC","N Manna, S Kumar, R Kakar, S Nayak, JK Rout, BK Balabantaray","2022 IEEE India Council International Subsections Conference (INDISCON), 1-6",", 2022","","https://scholar.google.com/citations?user=kWDOTCUAAAAJ&hl=en&oi=ao","2022"
"Survey on Natural Language-Based Person Search","https://scholar.google.com/citations?view_op=view_citation&hl=en&user=kWDOTCUAAAAJ&cstart=20&pagesize=80&citation_for_view=kWDOTCUAAAAJ:_Qo2XoVZTnwC","S Sarangi, JK Rout","Cognitive Informatics and Soft Computing: Proceeding of CISC 2021, 609-617",", 2022","","https://scholar.google.com/citations?user=kWDOTCUAAAAJ&hl=en&oi=ao","2022"
"Exploring Historical Stock Price Movement from News Articles Using Knowledge Graphs and Unsupervised Learning","https://scholar.google.com/citations?view_op=view_citation&hl=en&user=kWDOTCUAAAAJ&cstart=20&pagesize=80&citation_for_view=kWDOTCUAAAAJ:mB3voiENLucC","A Jain, B Chakrabarti, Y Upmon, JK Rout","Intelligent Data Engineering and Analytics: Proceedings of the 9th …",", 2022","","https://scholar.google.com/citations?user=kWDOTCUAAAAJ&hl=en&oi=ao","2022"
"Hybrid Approach to Prevent Accidents at Railway: An Assimilation of Big Data, IoT and Cloud","https://scholar.google.com/citations?view_op=view_citation&hl=en&user=kWDOTCUAAAAJ&cstart=20&pagesize=80&citation_for_view=kWDOTCUAAAAJ:hC7cP41nSMkC","S Swain, JK Rout, KS Sahoo","Advances in Machine Learning for Big Data Analysis, 189-222",", 2022","","https://scholar.google.com/citations?user=kWDOTCUAAAAJ&hl=en&oi=ao","2022"
"IoT-Enabled Smart Dustbin","https://scholar.google.com/citations?view_op=view_citation&hl=en&user=kWDOTCUAAAAJ&cstart=20&pagesize=80&citation_for_view=kWDOTCUAAAAJ:e5wmG9Sq2KIC","S Nayak, A Narayan, JK Rout","IoT-Based Smart Waste Management for Environmental Sustainability, 99-120",", 2022","","https://scholar.google.com/citations?user=kWDOTCUAAAAJ&hl=en&oi=ao","2022"
"Android Malware Detection Using Ensemble Feature Learning","https://scholar.google.com/citations?view_op=view_citation&hl=en&user=kWDOTCUAAAAJ&cstart=20&pagesize=80&citation_for_view=kWDOTCUAAAAJ:r0BpntZqJG4C","SS Rout, LK Vashishtha, K Chatterjee, JK Rout","International Conference on Information Systems and Management Science, 531-539",", 2021","","https://scholar.google.com/citations?user=kWDOTCUAAAAJ&hl=en&oi=ao","2021"
"Diabetes Prediction using Machine Learning Techniques","https://scholar.google.com/citations?view_op=view_citation&hl=en&user=kWDOTCUAAAAJ&cstart=20&pagesize=80&citation_for_view=kWDOTCUAAAAJ:qUcmZB5y_30C","K Singh, JK Rout, H Das","2019 International Conference on Intelligent Computing and Remote Sensing …",", 2021","","https://scholar.google.com/citations?user=kWDOTCUAAAAJ&hl=en&oi=ao","2021"
"The Farmer's Support System: IoT in Agriculture","https://scholar.google.com/citations?view_op=view_citation&hl=en&user=kWDOTCUAAAAJ&cstart=20&pagesize=80&citation_for_view=kWDOTCUAAAAJ:mVmsd5A6BfQC","JK Rout, B Mohanty, S Priya, P Mehrotra, N Bhattacherjee","IoT Applications, Security Threats, and Countermeasures, 119-141",", 2021","","https://scholar.google.com/citations?user=kWDOTCUAAAAJ&hl=en&oi=ao","2021"
"Machine Learning-Based Smart Health-care Systems","https://scholar.google.com/citations?view_op=view_citation&hl=en&user=kWDOTCUAAAAJ&cstart=20&pagesize=80&citation_for_view=kWDOTCUAAAAJ:Wp0gIr-vW9MC","AK Swain, BK Balabantaray, JK Rout","IoT Applications, Security Threats, and Countermeasures, 195-208",", 2021","","https://scholar.google.com/citations?user=kWDOTCUAAAAJ&hl=en&oi=ao","2021"
"Exploring and Presenting Security Measures in Big Data Paradigm","https://scholar.google.com/citations?view_op=view_citation&hl=en&user=kWDOTCUAAAAJ&cstart=20&pagesize=80&citation_for_view=kWDOTCUAAAAJ:4TOpqqG69KYC","AK Pradhan, JK Rout, NK Ray","Privacy and Security Issues in Big Data: An Analytical View on Business …",", 2021","","https://scholar.google.com/citations?user=kWDOTCUAAAAJ&hl=en&oi=ao","2021"
"Edge of Things-Based Smart Speed Monitoring System: A Smart City Initiative","https://scholar.google.com/citations?view_op=view_citation&hl=en&user=kWDOTCUAAAAJ&cstart=20&pagesize=80&citation_for_view=kWDOTCUAAAAJ:ULOm3_A8WrAC","B Acharya, R Gupta, PK Sahoo, JK Rout, N Ray","International Conference on Emerging Trends and Advances in Electrical …",", 2020","","https://scholar.google.com/citations?user=kWDOTCUAAAAJ&hl=en&oi=ao","2020"
"A Novel Encryption Scheme for Securing Data in HDFS Environment Inspired by DNA.","https://scholar.google.com/citations?view_op=view_citation&hl=en&user=kWDOTCUAAAAJ&cstart=20&pagesize=80&citation_for_view=kWDOTCUAAAAJ:8k81kl-MbHgC","S Haidari, AK Dash, JK and Rout","International Journal of Recent Technology and Engineering (IJRTE) 8 (6 …",", 2020","","https://scholar.google.com/citations?user=kWDOTCUAAAAJ&hl=en&oi=ao","2020"
"Detection of Deceptive Online Reviews using Machine Learning Techniques","https://scholar.google.com/citations?view_op=view_citation&hl=en&user=kWDOTCUAAAAJ&cstart=20&pagesize=80&citation_for_view=kWDOTCUAAAAJ:ufrVoPGSRksC","JK Rout","","","","https://scholar.google.com/citations?user=kWDOTCUAAAAJ&hl=en&oi=ao","2018"
"OCIT 2022","https://scholar.google.com/citations?view_op=view_citation&hl=en&user=kWDOTCUAAAAJ&cstart=20&pagesize=80&citation_for_view=kWDOTCUAAAAJ:bEWYMUwI8FkC","A Swetapadma, AM Arora, AV Chandak, A Nanda, B Acharya, B Pusti, ...","","","","https://scholar.google.com/citations?user=kWDOTCUAAAAJ&hl=en&oi=ao",""
"We wish thanks to all IEEE AIMV 2021 Reviewers","https://scholar.google.com/citations?view_op=view_citation&hl=en&user=kWDOTCUAAAAJ&cstart=20&pagesize=80&citation_for_view=kWDOTCUAAAAJ:dhFuZR0502QC","AK Nayak, PK Panigrahi, R Chaure, DR Sahu, J Rout, MM Vegad, ...","","","","https://scholar.google.com/citations?user=kWDOTCUAAAAJ&hl=en&oi=ao",""
"An Optimal Deep Learning Approach for Classification of Age Groups in Social Network","https://scholar.google.com/citations?view_op=view_citation&hl=en&user=kWDOTCUAAAAJ&cstart=20&pagesize=80&citation_for_view=kWDOTCUAAAAJ:3fE2CSJIrl8C","AK Swain, BK Balabantaray, JK Rout, S Satpathy","","","","https://scholar.google.com/citations?user=kWDOTCUAAAAJ&hl=en&oi=ao",""
"ICIT 2018","https://scholar.google.com/citations?view_op=view_citation&hl=en&user=kWDOTCUAAAAJ&cstart=20&pagesize=80&citation_for_view=kWDOTCUAAAAJ:roLk4NBRz8UC","AK Dash, R Pradhan, J Kumar, JK Rout, NK Ray, AK Nayak, SB Panda, ...","","","","https://scholar.google.com/citations?user=kWDOTCUAAAAJ&hl=en&oi=ao",""